{
  "datasetVersion": "1.0.0",
  "datasetId": "phase5d-governed-source-sync",
  "description": "Deterministic controlled-fixture release coverage for MES, PLM, QMS and cross-store recovery.",
  "cases": [
    { "caseId": "P5D-MES-001", "domain": "mes", "title": "Snapshot success", "probeId": "mes-snapshot", "assertionIds": ["completed", "checkpoint"] },
    { "caseId": "P5D-MES-002", "domain": "mes", "title": "Incremental success", "probeId": "mes-incremental", "assertionIds": ["newer-version", "verified"] },
    { "caseId": "P5D-MES-003", "domain": "mes", "title": "Duplicate record idempotency", "probeId": "mes-duplicate-record", "assertionIds": ["no-duplicate-mutation"] },
    { "caseId": "P5D-MES-004", "domain": "mes", "title": "Duplicate page idempotency", "probeId": "mes-duplicate-page", "assertionIds": ["deduplicated"] },
    { "caseId": "P5D-MES-005", "domain": "mes", "title": "Out-of-order quarantine", "probeId": "mes-out-of-order", "assertionIds": ["quarantined", "no-checkpoint"] },
    { "caseId": "P5D-MES-006", "domain": "mes", "title": "Stale metric protection", "probeId": "mes-stale", "assertionIds": ["no-stale-overwrite"] },
    { "caseId": "P5D-MES-007", "domain": "mes", "title": "Missing unit rejection", "probeId": "mes-missing-unit", "assertionIds": ["validation-blocked"] },
    { "caseId": "P5D-MES-008", "domain": "mes", "title": "Cursor resume", "probeId": "mes-cursor-resume", "assertionIds": ["monotonic-checkpoint"] },
    { "caseId": "P5D-MES-009", "domain": "mes", "title": "Version conflict quarantine", "probeId": "mes-version-conflict", "assertionIds": ["hash-conflict-not-published"] },
    { "caseId": "P5D-MES-010", "domain": "mes", "title": "Governed tombstone", "probeId": "mes-tombstone", "assertionIds": ["deactivate", "no-delete"] },

    { "caseId": "P5D-PLM-001", "domain": "plm", "title": "Proposed engineering change", "probeId": "plm-proposed", "assertionIds": ["mapped"] },
    { "caseId": "P5D-PLM-002", "domain": "plm", "title": "Approval transition", "probeId": "plm-approval", "assertionIds": ["governance-validated"] },
    { "caseId": "P5D-PLM-003", "domain": "plm", "title": "Proposed as effective rejection", "probeId": "plm-effective-denied", "assertionIds": ["not-auto-promoted"] },
    { "caseId": "P5D-PLM-004", "domain": "plm", "title": "Stale update rejection", "probeId": "plm-stale", "assertionIds": ["no-stale-overwrite"] },
    { "caseId": "P5D-PLM-005", "domain": "plm", "title": "Out-of-order version", "probeId": "plm-out-of-order", "assertionIds": ["quarantined"] },
    { "caseId": "P5D-PLM-006", "domain": "plm", "title": "Same version hash conflict", "probeId": "plm-hash-conflict", "assertionIds": ["not-published"] },
    { "caseId": "P5D-PLM-007", "domain": "plm", "title": "Missing validation", "probeId": "plm-missing-validation", "assertionIds": ["blocked"] },
    { "caseId": "P5D-PLM-008", "domain": "plm", "title": "Duplicate change", "probeId": "plm-duplicate", "assertionIds": ["idempotent"] },
    { "caseId": "P5D-PLM-009", "domain": "plm", "title": "Unauthorized tenant", "probeId": "plm-tenant-denied", "assertionIds": ["authorization-denied"] },
    { "caseId": "P5D-PLM-010", "domain": "plm", "title": "Cancelled change tombstone", "probeId": "plm-cancelled", "assertionIds": ["supersede", "no-delete"] },

    { "caseId": "P5D-QMS-001", "domain": "qms", "title": "Approved current revision", "probeId": "qms-approved", "assertionIds": ["published", "evidence-current"] },
    { "caseId": "P5D-QMS-002", "domain": "qms", "title": "New document revision", "probeId": "qms-new-revision", "assertionIds": ["versioned"] },
    { "caseId": "P5D-QMS-003", "domain": "qms", "title": "Superseded revision", "probeId": "qms-superseded", "assertionIds": ["not-current"] },
    { "caseId": "P5D-QMS-004", "domain": "qms", "title": "Draft rejection", "probeId": "qms-draft", "assertionIds": ["not-published"] },
    { "caseId": "P5D-QMS-005", "domain": "qms", "title": "Obsolete rejection", "probeId": "qms-obsolete", "assertionIds": ["not-current"] },
    { "caseId": "P5D-QMS-006", "domain": "qms", "title": "Content hash mismatch", "probeId": "qms-hash", "assertionIds": ["blocked"] },
    { "caseId": "P5D-QMS-007", "domain": "qms", "title": "Unknown canonical link", "probeId": "qms-unknown-link", "assertionIds": ["quarantined"] },
    { "caseId": "P5D-QMS-008", "domain": "qms", "title": "Instruction injection quarantine", "probeId": "qms-injection", "assertionIds": ["security-quarantine"] },
    { "caseId": "P5D-QMS-009", "domain": "qms", "title": "Evidence access denied", "probeId": "qms-access", "assertionIds": ["authorization-denied"] },
    { "caseId": "P5D-QMS-010", "domain": "qms", "title": "Duplicate revision", "probeId": "qms-duplicate", "assertionIds": ["idempotent"] },

    { "caseId": "P5D-X-001", "domain": "cross-source-recovery", "title": "MES and PLM shared canonical merge", "probeId": "cross-merge", "assertionIds": ["source-authority-governed"] },
    { "caseId": "P5D-X-002", "domain": "cross-source-recovery", "title": "PLM and QMS version alignment", "probeId": "cross-version", "assertionIds": ["version-aligned"] },
    { "caseId": "P5D-X-003", "domain": "cross-source-recovery", "title": "Cross-source conflict", "probeId": "cross-conflict", "assertionIds": ["quarantined"] },
    { "caseId": "P5D-X-004", "domain": "cross-source-recovery", "title": "Partial graph publication", "probeId": "partial-graph", "assertionIds": ["recovery-required", "no-checkpoint"] },
    { "caseId": "P5D-X-005", "domain": "cross-source-recovery", "title": "Partial document publication", "probeId": "partial-document", "assertionIds": ["recovery-required", "no-checkpoint"] },
    { "caseId": "P5D-X-006", "domain": "cross-source-recovery", "title": "Restart recovery", "probeId": "restart-recovery", "assertionIds": ["interrupted-detected"] },
    { "caseId": "P5D-X-007", "domain": "cross-source-recovery", "title": "Checkpoint corruption", "probeId": "checkpoint-corruption", "assertionIds": ["fail-closed"] },
    { "caseId": "P5D-X-008", "domain": "cross-source-recovery", "title": "Reconciliation mismatch", "probeId": "reconciliation-mismatch", "assertionIds": ["blocking"] },
    { "caseId": "P5D-X-009", "domain": "cross-source-recovery", "title": "Unauthorized publication", "probeId": "publication-denied", "assertionIds": ["no-publication"] },
    { "caseId": "P5D-X-010", "domain": "cross-source-recovery", "title": "Missing lineage", "probeId": "lineage-missing", "assertionIds": ["blocking"] }
  ]
}
